{
  "schemaVersion": 1,
  "generatedAt": "2026-03-23T00:00:00.000Z",
  "release": {
    "version": "3.0.0-rc.1",
    "channel": "rc",
    "gitCommit": "abcdef1234567890abcdef1234567890abcdef12"
  },
  "assets": [
    {
      "path": "dist/signaler-3.0.0-rc.1.tgz",
      "sha256": "aaaaaaaaaaaaaaaaaaaaaaaaaaaaaaaaaaaaaaaaaaaaaaaaaaaaaaaaaaaaaaaa",
      "sizeBytes": 1234567
    },
    {
      "path": "release-assets/signaler-3.0.0-rc.1-win-x64.zip",
      "sha256": "bbbbbbbbbbbbbbbbbbbbbbbbbbbbbbbbbbbbbbbbbbbbbbbbbbbbbbbbbbbbbbbb",
      "sizeBytes": 4567890
    }
  ],
  "gateReports": [
    {
      "id": "v3-release-phase1",
      "path": "benchmarks/out/v3-release-gate.json",
      "status": "ok"
    },
    {
      "id": "v63-success-gate",
      "path": "benchmarks/out/v63-success-gate.json",
      "status": "warn"
    }
  ],
  "environment": {
    "nodeVersion": "v24.11.0",
    "platform": "win32-x64",
    "packageManager": "pnpm"
  }
}
